{
  "spec": {
    "name": "sitepack",
    "version": "1.0.0"
  },
  "kind": "volume-set",
  "packageId": "example-volume-set",
  "container": "zip",
  "maxPartSize": 104857600,
  "bootstrap": {
    "volumeIndex": 1,
    "containsManifest": true,
    "containsCatalog": true
  },
  "volumes": [
    {
      "index": 1,
      "count": 2,
      "file": "example.part1.sitepack",
      "size": 0,
      "sha256": "0000000000000000000000000000000000000000000000000000000000000000"
    },
    {
      "index": 2,
      "count": 2,
      "file": "example.part2.sitepack",
      "size": 0,
      "sha256": "0000000000000000000000000000000000000000000000000000000000000000"
    }
  ]
}
