{
  "spec": {
    "name": "sitepack",
    "version": "1.0.0"
  },
  "kind": "volume-set",
  "packageId": "example-cross-relations",
  "container": "zip",
  "maxPartSize": 5000,
  "bootstrap": {
    "volumeIndex": 1,
    "containsManifest": true,
    "containsCatalog": true
  },
  "volumes": [
    {
      "index": 1,
      "count": 1,
      "file": "sitepack.part1.sitepack",
      "size": 1712,
      "sha256": "94a2062741e41feb5f982673cc251fe1e538172d0a7f7d1498f371a64a3cb791"
    }
  ]
}
